ID	text	Equality	Care	Non-Moral	Authority	Thin Morality	Loyalty	Proportionality	Purity
4114	Glad to hear you're doing better! Anything in particular change to help with the existential dread that comes from the realization that your continued existence is entirely contingent on your employer and that they have unlimited power to revoke your access to food, medical services, and protection from random beatings on the street by a gang of uniformed thugs with a literal licence to kill?	0	3	0	2	0	0	0	0
8328	Ive said it for years now.... Religion is an ideology &amp; belief and its banned from schools Politics is also an ideology and belief yet we allow it to run rampant in our schools BOTH or neither should be banned I never knew my teachers political views while in school (Class of 89) yet all of my children knew their teachers views. They all were leftists and talked about theirs views in class while bashing conservatives views Schools are not teaching our kids to be prepared for life, they are programming them to be liberals later in life	0	0	1	2	0	0	0	0
9199	Make no mistake, Le Pen vs. Mlenchon would also be an absolute disaster for Europe and the EU. Both want France to leave the EU. I hope Macron wins and radically changes French politics, because maintaining the status quo is at least as dangerous as Le Pen or Mlenchon. And if this doesn't end in a complete clusterfuck, we still have to hope Italy won't vote for M5S in the next election.	0	0	1	1	1	0	0	0
812	"&gt;""The most successful neoliberal candidate of recent years was Emmanuel Macron, who basically owns French politics now, he said. Hes a former big shot Rothschild banker who married a woman 25 years his senior. Even our biggest winners dont exactly exude cool."" Are you kidding, Macron is living the dream."	0	0	2	1	0	0	0	0
2739	Can we label these guys as terrorists so that they lose their rights? We need to take these violent traitors, interrogate them, and dismantle the entire thing before it gets worse. This is insane	0	1	0	1	0	3	0	0
8658	"Le Pen spread her own anti-Le Pen propaganda. She just called it a ""campaign"" instead. Seriously, most of my opinion on her came from watching her own speaking engagements and her complete willingness to abandon almost every one of her convictions *except hardcore nationalism* makes my skin crawl."	0	0	0	1	1	0	1	0
11809	So your job as parents is to completely disregard their feelings and emotions? How messed up is that!	0	2	0	1	1	0	0	0
17406	I dont want words, I want action! Cool, elect him to office and give him congress as well. No vote, only action!	0	0	2	1	0	0	0	0
12452	That's one more reason to vote for Macron. He does brave things, that not everyone can achieve, even though most dream about it!	0	0	1	1	1	0	0	0
14126	Trump and his admin should face criminal charges for this disaster. Many many people are going to die because of Trumps inaction, lies and misinformation.	0	2	1	1	0	0	1	0
7686	It does because for all his anti-european discourse, Melenchon's support include many pro-european factions, such as ecologists and socialists who don't agree with his European stance. Melenchon's team also include seasoned politicians who know how to run the State's machinery. In contrast, Le Pen's team have always been outcast, never led any major official charges. They are out of the loop, and therefore much more likely to do massive damages before they realize that much of their promises are just unrealistic.	0	0	1	1	1	0	0	0
9587	"My guess is that's why he is glorified. Because not a lot of people heard him speak for more than 2 minutes in a non staged conversation. I used to follow him on Twitter because he seemed like a genuine ""chaotic good"" scientist. My opinion was based on internet praise I saw and few funny tweets he posted. Then I researched on him and... oh boy. That was the fastest unfollow ever."	0	0	0	1	2	0	0	0
9378	Melenchon is literally a communist. and I don't mean American-communist, I mean an _actual_ communist.	0	0	1	1	0	0	1	0
7894	It's also an absolute open secret Putin has been bankrolling Le Pen. Russia has foreign policy objectives, and like every other major world power they try to use whatever means possible to achieve them. Occam's Razor doesn't rule out this one. 	0	0	2	1	0	0	0	0
2220	BS. The EU establishment is pervasively globalist, they have to be or else they wouldn't have money or power. Le Pen is a nationalist. This is a smear job. 	1	0	1	1	0	1	0	0
15153	Why Le Pen didn't release her emails? What's she is hiding?	0	0	2	1	0	0	0	0
15549	Yeah I agree with this. Sounds like blasphemy in this sub, but Hillary needed to do a better job as a campaigner. However, we seem to be doing better in Europe this year. Fended off the populists in the Netherlands, hopefully will win in France and Germany. Macron is a good model for neoliberal politicians at the moment -- he's adopted some of the techniques of populism without any of the debilitating ideology.	0	0	1	1	1	0	0	0
8789	Liberals use this excuse as a way to justify their judicial activism in which it is partially or completely disregarded to suit their political and ideological agendas, essentially treating this document that the country was founded on like toilet paper. Not happening this time. You dont get to shit on the Constitution this time.	0	0	1	1	1	0	0	0
1535	Agreed. Obviously the Democratic leaders In those want it to continue be Star they feel it hurts Trump. It doesnt matter to them that innocent lives are in danger. Thats why they dont want Trumps help. Because Trump would put a stop to it and would make them look the morons that they are	0	3	0	1	0	0	0	0
2123	"As much as the idea of a refuged goth nobility ""reconquering"" the whole peninsula from a cathartic epic win in 722 is utterly stupid I find equally stupid the insistence in highlighting those lands weren't ""theirs"" and were ""rightful muslim clay"" in a ""legal basis"", because you are projecting post-Westfalian constructs of international law to the past."	1	0	1	1	0	0	0	0
2010	Are you disagreeing with his statement? Because it's painfully obvious. You'd think someone like Marine Le Pen in France would be applauded by the left. A strong, independent woman trying to lead, and yet she's constantly attacked. She's the pinnacle of true feminist ideals and yet is hated because of her anti-globalist stance. 	2	0	0	1	0	1	0	0
12145	Tbh. I kinda liked Hamon from is proposals, some of Mlenchons stuff seems to be to abrupt a change for me (tho e.g. I wholeheartedly support him in trying to change the EU), but looking at the failure of the current PS government I can understand people not wanting to vote for them.	0	0	1	1	1	0	0	0
16584	Yup, no kids. We have to starve the beast of consumerism.	0	0	1	1	1	0	0	0
11015	Political immunity is not supposed to prevent against laws. After all, if it were, then MEP's could go on a robbery or murder spree without consequences. Political immunity is supposed to protect against unjustified persecution. In this case Le Pen did post those images, and France does have a law against them, so lifting the immunity is the only logical option. Not lifting it would be attacking the sovereignity of the French state.	0	0	0	1	0	0	1	1
2342	Because the majority of those guns belong to people that are begging to submit to the authoritarian already in office. The Dont tread on me bullshit they used to ascribe to is more like oh yeah tread harder Cheeto man Edit: [visual](https://images.app.goo.gl/KEnDiwzCWxM9zu1S7)	0	0	0	1	1	1	0	0
1068	&gt;We have a history in this country of election problems. We have a history of GOP voter suppression and electoral fraud. And trump's actions are the most glaring examples of those anti-democratic tactics.	0	0	1	1	0	1	0	0
8063	"It's surprising how many people don't understand their motives. They have stated it as plainly as they can. Their goal is to overthrow the western-friendly governments in Iraq, Saudi Arabia, etc, so they can create the ""Islamic State"". To do this, they must have people on their side. Terrorism creates the hate needed so that their own people will have to pick sides - us or them. So does Le Pen. It's very simple.. "	0	0	2	1	0	0	0	0
2925	Considering her background, contacts, funding and personal agenda, supporting Le Pen at this point is extremely difficult to justify from a rational standpoint. 	0	0	1	1	1	0	0	0
12472	That's the establishment logic creeping up on ya. You gotta resist man. The Democrat has been using that on the green and vote shaming everyone of them they come across. The DNC is supported by imbeciles and zombies. Let's be better!	0	1	0	1	1	0	0	0
9924	Negligence. Any good ambulance chaser could spin a case for me to pay also	0	1	0	1	2	0	0	0
11151	Qatar really isn't that huge in international politics or in France's domestic policies. France isn't exactly going to do much for them except the status quo, but it's better for them than a French warming toward Iran and Syria. Russia, however, wants to dismantle the economic power of the EU so it can expand economically and occasionally militarily through European countries, which Le Pen is definitely in support of. The same Russia which assassinates political opponents and treats other countries as nova Russia. Your long-winded condescension is pretty baseless and immature. 	0	1	0	1	1	1	0	0
2434	Biden needs to reinstate the Fairness Doctrine, and then Democrats need to make it a law, perhaps beefed up a little. The constant conspiracy theory peddling is going to cause more violence.	1	0	1	2	0	0	0	0
2683	CNN acted pretty much the same way over Brexit, and would have acted the same way if they believed that Trump would probably win in 2016 (not that anyone really believed he was going to win). If Le Pen wins, she said she would immediately pull France from the EU. Would that be enough to collapse the Euro altogether?	0	0	1	1	1	0	0	0
1140	&gt;someone like Bernie seemed to be able to get people moving that Clinton unfortunately couldn't I think this is far more about personality than policy. cf. Macron. Oh, and you're the guy who was concern trolling about immigration yesterday? *Imagine my shock* Why do supposedly leftist Bernie supporters so often hate the global poor?	1	1	0	1	1	0	0	0
9747	NTA they wanted it early, you gave them the terms and they agreed they are old enough to understand. They said they understood and now are whining about not getting anything else. Stand your ground.	0	2	0	1	0	0	0	0
5681	I hate Harper as a politician. I didn't doubt for a second he was competent and he has Canada's best interest at hearth. To me he was a political opponent, not a threat to the nation. I feel it's very different with people like le Pen and Trump.	0	0	0	1	1	0	1	1
3258	Doesn't seem like the actions of an innocent or capable man running for POTUS	0	0	1	1	1	0	0	0
172	"""The president can do whatever he wants to win an election, even if that means enlisting foreign powers. What's good for the president is good for the American people."" The fact that we're waiting to see whether even 51 Senators will not accept this claim outright (not even reject it, just to listen to more evidence before they make up their minds) makes me nauseous."	0	0	0	2	0	0	0	1
9546	My cousin's name is Tucker. We were explicitly told we were not allowed to play the name game. That is how I figured out a new curse word!	0	0	2	1	0	0	0	0
1134	&gt;police are public servants Public servants, not GIs. He can have whatever flag he wants.	0	0	2	1	0	0	1	0
2147	As well as what? As Le Pen being prosecuted for undermining human dignity?	0	2	0	2	0	0	0	2
698	"&gt; Yeah Fillon is corrupt but the others are too Well... aren't they? A ""totally clean politician"" is an oxymoron. IMO choosing one or the other boils down to ""which one is *least* corrupt?"", or corrupt/incompetent. In Fillon's case, I guess that he was either unlucky to get caught with worst timing, or more likely, his corruption was just dumber/bigger. (Though mind you, doesn't Le Pen also have similar scandals around her? And yet her support doesn't seem to be falling much.)"	0	0	0	2	1	0	0	0
12464	That's really not what I understood: people on the far left are those pretending those issues don't exist. What I understood was they thought Macron would ruin France by saving its economy (doing stuff like allowing companies to fire employees and finally up the retirement age), so they feared populism would rise. Basically they hate Macron for the reasons I love him... 	0	0	1	1	1	0	0	0
12297	That is brutal and completely accurate. Dear god, here's hoping the French people listen and don't elect another Putin puppet. How the hell does authoritarian nationalism rise in a place like France anyway? Macron's totally right, France is full of fields bombed to oblivion by the last nationalists to occupy the country.	0	1	0	3	0	1	0	0
16505	Your mom probably knew you were faking and told the doctor to say you had fractures so you would have to wear the stupid brace and learn your lesson lmao.	0	1	2	1	0	0	0	0
10467	OP, look at what you typed. I think you already know youre not if you decide to leave. Your parents seem to only intervene if its convenient to themselves and not to those around them. Not to mention the lack of discipline towards your sister who seems to be the immature one. If you feel the need to move out, then move out. NTA	0	0	1	2	0	0	0	0
11555	"She was using it for her own propaganda purposes, posting very NSFL images of the Syrian pilot getting burned alive and an American getting beheaded along with captions that says ""This is what daesh is like!"" in French. It was extremely tasteless and greatly upset the family of the American that his death was used as a propaganda prop for Le Pen's personal gains."	0	3	0	1	0	0	0	1
3871	For the people who like to go on about the impending return of Jesus, the identity of the Antichrist is dependent on the latest popular left-leaning person. For this reason, you can find people who have predicted that Bill Clinton (because he helped implement NAFTA) and Barack Obama (because he was a hella charismatic POC) were the Antichrist. I'm sure that somewhere someone thinks Merkel is the Antichrist, and I wouldn't be surprised if Macron was a candidate too.	0	0	1	1	1	0	0	0
5362	I don't give a rat's ass how I'm treated once I'm dead. I'm much more concerned about how our government treats the living.	0	0	0	1	2	0	0	0
1320	5 years is plenty of time, In 5 years I'll have my engineering degree, not a simple shift supervisor anymore, so I'll be better able to handle the inevitable economic crash of a possible Le Pen presidency in the EU's second largest economy. 	0	0	2	1	0	0	0	0
3497	Encouraging others to commit crime/violence is against the law. He probably thinks it is okay, because he sees his dad doing it all the time...,	0	0	1	2	0	0	0	0
15739	Yeah, report her then. Will make things easy for you personally and possibly save a few peoples job!	0	1	1	2	0	0	0	0
13795	This is...a very specific fetish/kink to be consuming so extensively at 9 years old. This could be a sign something else is going on. OP pls reach out to your parents for next steps, this is way above your, and our, paygrade	0	2	1	1	0	0	0	1
6580	I will definitely press charges, my uncle is the one dealing with it all so Im trusting him haha	0	0	2	1	0	1	0	0
12113	THE POLLS MEAN NOTHING. SHOW UP AND VOTE ^(for ^macron)! NO FALSE CONFIDENCE!	0	0	2	1	0	1	0	0
9776	NTA, your mother is being unreasonable asn overbearing. Do you like having multiple video chats a day? Does it affect your mental health? I'd tell her she needs to take a step back and respect your wishes. Shes being very rude	0	2	1	1	0	0	0	0
12042	"Such as stopping [privatization of public services](https://laec.fr/section/51/plan-a-proposer-une-refondation-democratique-sociale-et-ecologique-des-traites-europeens-par-la-renegociation). Melenchon wants to tell Danes or Greeks what to do with their countries. Or eliminating the independence of ECB, which basically means that politicians will start printing money like crazy (see also ""Dvaluer l'euro pour revenir la parit initiale avec le dollar"")."	0	0	2	1	0	0	0	0
8533	Laws are only as good as the enforcement of said laws.	0	0	1	1	1	0	0	0
4926	How is Macron a corrupt candidate? Serious question, I did some googling but I didn't find anything. Considering that Le Pen / Mlenchon are interventionists and want to increase the power of the (their) political elite, I don't see how that will help to reduce corruption.	0	0	2	1	0	0	0	0
1424	Aaaand you're not getting elected. You've just alienated centrists, who you'll need if you want to stand any chance of getting elected. Good fucking job Le Pen.	0	0	1	1	1	0	0	0
11514	She didnt even say this. She was actually trying to talk to someone on the panel. The minders INTERRUPTED them and said I think were all set. Its very strange to watch. Like... shouldnt she be the one dictating? I mean if she doesnt want to take any questions ok, but who is really in charge that they have the authority to interrupt her and cut her off?	0	0	1	2	0	0	1	0
12185	Thank god. Le Pen would have been a disaster for not only France but the EU and foreign affairs.	0	1	0	1	2	0	0	0
10866	People act like showing your superiors that youre willing to be their pack mule will earn their respect. All it will do is teach them how badly they can treat you and still keep you around	0	1	0	1	1	0	0	0
11048	Practicing without a license and lying to a judge about it? Throw the book at him.	0	0	2	1	0	1	1	0
12613	The German Constitution did not let Hitler become an authoritarian. Your definition doesn't make sense buddy. Le Pen is a fascist. 	1	0	1	1	0	0	0	0
4992	Hypothesis: As populism becomes mainstream, a pro internationalist counter culture will emerge to combat the reactionaries, sending a new generation of non ideological (((technocrats))) to the halls of power. Macron is just the beginning. Soon enough, we shall have president Bernke and helicopter money will fall from the heavens like mana.	0	0	0	3	0	0	0	0
4177	Good for you! Great idea and youre right to be disturbed. Thats not a fetish, this is a crime.	0	0	0	1	1	0	0	2
8323	Ive never before had this thought about my own real life, but Im just now thinking Having a CHAOTIC EVIL president might actually be less painful than a LAWFUL EVIL president. Imagine how much worse things would be if Trump were self-disciplined, well-spoken, and, well, a reader.	0	0	0	1	2	0	0	0
89	"""Guys, the EU is collapsing, what should we do?"" ""Close the borders and manage our finances?"" ""Shoot Le Pen?"" ""No! We've got to form our own military."" "	0	1	1	1	0	0	0	0
1380	A lot a misogynist men are salty about this, so Macron is doing awesome.	2	1	0	1	0	0	0	1
824	&gt;AITA for cutting off my penis **what the--** &gt;\-mutilating MIL? *oh.* anyway, NTA, please protect your child.	0	3	0	1	0	1	0	1
12005	Still ongoing. It's a bit of a shitshow. Not a calm debate. Le Pen is aggressive so Macron has to interrupt to defend against all the lies. Macron is keeping his calm and that's pretty remarkable. He gained a lot in my esteem. Honestly Le Pen is a poor debater. Marine Le Pen is condescending and laughing at him. Macron is explaining, not backing down. 	0	0	1	1	1	0	0	0
12309	That is the problem and unfortunately asking to be left alone was not enough. Playing Mr. nice guy and capitulating failed. They have control in virtually every sector and they rule like nazis	1	2	0	1	0	0	0	0
6515	I wanted Macron to win because he is just a little bit more Libertarian than Le Pen, but come on, calling Le Pen a fascist is just downright propaganda.	0	0	1	1	1	0	0	0
1074	&gt;What the actual fuck, how is the 19 year old the brattiest of all the children in your home? Best guess is that parents never curbed it when younger. Of course some people are just like that regardless, but I know in my family that was the issue. No one told certain favored sibling that acting a certain way was unacceptable and now shes a bratty adult. When they're really used to getting their way they don't understand you dont get to call all the shots in the house	0	0	0	2	1	0	0	0
13176	There is 0 guarantee macron won't turn into a dictator. Most democratic countries have mechanisms in place to avoid authoritarian take over. You are fear mongering. 	0	0	1	1	1	0	0	0
2481	Boston seems like a great city to study in. You're right about Brexit making the UK such a big IF, it's a shame because the UK could've literally been the leader of the bloc, but apparenty having less immigrants was more important than their economy, geopolitical power and reputation such patriots. I'm interested to see how France turns around with Macron in power, since he's the most liberal president they've ever had. I'm hoping that Macron and Merkel use the unpredictability of our idiotic president to their advantage and push for a federal Europe. 	0	0	1	1	1	0	0	0
256	"&gt; But it's true that it has nothing to do with sex Sure. Your little penis-sucking secret is safe with us. &gt; it has to do with backwards people Unlike all the ""forwards"" people who want to slice off chunks of infant boys' penises to please their invisible sky-god LOL. "	0	0	1	1	1	0	0	0
2931	Considering the age of your account and your predictable *opinion* about Trump, Le Pen, Assad, Brexit and Putin: between you and me mate, how do you think this will end? The west will roll over? Putin victory lap? Devolving of the EU and NATO and Russia retaking it's place as a superpower? Or will the western democracy autoimmune system kick in: impeach Trump, vote Macron, closer ties between western countries and crippling sanctions on Russia?	0	0	2	1	0	0	0	0
2989	Cretins* Trump is the festering infection that is the symptom of the autoimmune deficiency that is the modern GOP. Its more than just one bad apple. The whole lot are corrupt, and none should go without seeing some form of retribution. They should be cast out of the political spotlight the way the Nazis were. As a bunch of awful, soulless mass murderers. No less, but possibly more.	1	1	0	1	1	0	0	2
2599	"But it's not really what polls are saying... I mean, Hollande had similar approval ratings right after his election, but I don't think you could have said he was *popular* even at the time. It's just people saying ""eh, could have been worse"". He's not *un*popular, that's for sure, but a lot of people are skeptical, or just don't like him. There are also those who dislike him but are OK with his government, and so say they're satisfied for the moment."	0	0	1	1	0	0	1	0
9176	Macron's trying to steal Le Pen voters that aren't crazy neo-Nazis. 	0	0	2	1	0	0	0	0
3255	"Doesn't matter. They'll be willing to pour enormouse resources behind convicting a few ""ring leaders"" and others pulled in to bulk up the numbers thus instructing those who would protest not to risk it."	0	0	2	1	0	0	0	0
14587	Weird how you call Le Pen an extremist while the real ones are gunning down cops. 	0	0	1	2	0	0	0	0
3483	Election interference is pretty normal and exists in all ways, shapes and sizes. For example, Obama supported Macron in the French election. If that's not textbook election interference, not sure what to tell you. The trick is to be careful about what kinds of election interference there is and ensure how we react to it isn't hypocritical.	0	0	2	1	0	0	0	0
7926	It's fine to celebrating him winning, but Le Pen is growing and her chances in 2022 have always been greater than her chances in 2017. 	0	0	1	1	0	1	1	0
884	"&gt;Her son, she says, warned her against voting the National Front. ""He told me that Le Pen is just talking big and won't keep her promises either. So now I am going to vote for [Jean-Luc] Melenchon, the communist."" Oh wow, cleary communism is the better choice. What a smart son you have"	0	0	1	1	0	0	1	0
14334	Valls isn't liked by many since a few years. From some sources,apparently Macron really didn't like him either,because Macron went to convince people from the right to vote for a law. For about 500 hours he tried until he finally succeed just to have Valls pass the law anyway by the 49.3(forcing from the majority )because he didn't want this law to be approved because of some voice from the right. A fucking dick move if that's real if you ask me.	0	0	2	1	0	0	0	0
9325	Mayor McCheese fucked my wife and I want legal compensation.	0	0	1	1	0	0	1	1
12875	The majority of the country might vote Le Pen. Elsewhere, it has already voted for people like Le Pen. Do you mean that majority, or some other one?	0	0	2	1	0	1	1	0
5427	I don't think Macron could hope to capture people at that level though. This is for people of generally ordinary ability to come to France and undercut local population's wages, firewalling resistance with appeals to French nostalgia for global leadership.	0	0	1	2	0	0	0	0
3541	Even leftists have a limit to the amount of bullshit they can swallow. The media is trying to convince them that this act of God combined with willfull negligence of the CCP is somehow Trump's fault and even they can se through the lie.	0	0	1	1	0	0	1	0
5298	I didn't realize he was busted for possession. I had always heard that he demanded too much money and so Dell dropped him.	0	0	2	1	0	0	0	0
16406	You'd be surprised! I live in a little 'village' in the north of France where most people vote either far left or far right. Those are the old 'ouvriers' (as in mostly factory workers) who put the blame of the dislocation of our industry and the loss of their jobs mostly on the EU. Both Mlenchon and Le Pen aspire to defend worker's rights (with Le Pen being obviously more focused on national workers). It's not too far fetched to see them vote for either of them.	1	0	2	1	0	0	0	0
8020	"It's nothing more than a power game. ""I can be honest about my intentions, and I can force you to be dishonest about yours."""	0	1	1	1	0	0	0	0
