ID	text	Equality	Care	Non-Moral	Authority	Thin Morality	Loyalty	Proportionality	Purity
2130	As some who voted to leave the EU, I think its quite insulting to compare Brexit to this. Marine Le Pen is a political extremist. To even compare her, even to people like Farage and Trump is very dishonest. We voted to ensure that the immigration we get is of a high standard and restore parliamentary sovereignty. Established politicians like Boris, IDS, Gove supported it. Le Pen wants to seal off her borders completely, impose dress codes in public and restrict the freedom of native minority groups (equivalent of scots and welsh in Britain) as well as foreign origin minorities. 	3	1	0	0	0	1	1	0
8006	It's not the minorities that are more violent but other people's reactions.	1	1	1	0	0	0	1	0
104	"""I hate people who argue like this"" Glad to know I have earned your hate. Regardless, I am still unclear why he needs the approval of the person who did a crappy thing to undo the crappy thing."	0	1	0	0	2	0	0	0
10821	Our voting system makes what Macron did impossible without the utter death of one of the existing parties IMO	0	1	2	0	0	0	0	0
679	&gt; What do they want now? They want nothing, everyone else is whining and complaining that someone who they call a bolshevik and always shown hatred and despise to won't bend over and encourage everyone to vote for a banker and a supporter of capitalist extremism. He already said Le Pen is a fascist and that he is an anti-fascist but somehow even if you are not a capitalist you must show support to a far-capitalist plan.	2	1	1	0	0	0	0	1
16952	in that thread i don't know, but i've certainly saw some of them implying M. Macron to have commendited the murder of this person. those guys don't have any respect 	0	1	0	0	1	0	0	1
13301	These people don't have a clue about Nazism, or American patriotism, so how could they make any comparison what-so-ever?	0	1	2	0	0	0	1	0
16237	You learn to despise people, and those that you love you don't have enough energy for and they learn to despise you eventually.	0	2	1	0	0	0	0	0
12373	That's a really interesting parallel. And it raises the question: do politicians care about our lives, or are we really just useful statistics they can use in an argument?	0	2	1	0	0	0	0	0
12938	The peaceful ones are not exactly innocent either. They are instigating and spreading hatred.	0	1	0	0	2	0	0	0
16335	You should give it back if you care about the relationship.	0	3	0	0	0	1	0	0
4794	"Holy shit, imagine viewing half the human population as a ""subcase."" How incredibly insulting and frankly, sickening."	1	2	1	0	0	0	0	2
3403	Dude, this is Le Pen's dad. AKA mr. banned from France office for flirting with nazis.	1	1	2	0	0	0	0	1
16411	You'll never convince people like this they could be vulnerable to scams. They don't have the critical reasoning skills to realise their aimless, pointless cynicism isn't skepticism. He literally thinks shaming her is *helping*.	0	1	1	0	1	0	0	0
15432	YTA He let you use his account and the first thing you do is insult his music taste.	1	1	1	0	0	0	0	1
3388	Dude sounds rude and immature fam. Dont let him make you think youre crazy. Your problems are not minuscule.	1	1	1	0	0	0	0	0
10158	"No, they won't. They'll blame her for not talking him into it. Source: I got blamed for ""allowing"" my spouse not to invite NC family members to our wedding. People literally demanded that I refuse to marry them unless they invited those relatives. These were people I'd met maybe four times at Christmas parties. It's always the woman's fault."	1	1	2	0	0	0	0	0
16090	You cant unring a bell. BF should leave you, he doesnt deserve it and your lack on understanding of the motive is irrelevant. Did you try to justify your actions to your BF the way you did here with the family issues and lack of intimacy, not that it really matters because that would probably just make him mad.	1	1	1	0	1	0	1	0
11192	Reading an explanation of that kind of videos are fucking upsetting enough But I still would not vote for Trump, Brexit or Le Pen as all they have been doing and is doing, is to emotionally manipulate.	0	2	0	0	1	0	1	0
13541	Thief! You must return them to their rightful owner, here give them to me, I'll take them there for you I promise	1	1	1	0	0	0	0	1
6659	I would fight you if you did this to me but hilarious none the less	0	1	1	0	1	0	0	0
4895	How could of them? They are M-word. Shame on them evil. I hope you disown them and won't help them ever.. Your passed soul cat don't deserve cruel.. I hate your grandparents for animal abuse. I'm so sorry for your loss.	0	3	0	0	0	0	0	2
9701	NTA Yelling at kids is NOT modeling healthy or positive behaviour. Its flat out bullying. Kids absolutely respond better to exactly what you said: show them how to do it and he needs to model the same behaviour himself. Dont excuse the fact that he yells at your kids as nothing. Its psychologically damaging.	0	3	0	2	0	0	0	0
10615	Oh, let me be perfectly clear: *Culture in no way justifies discrimination or bigotry*, period. My point was to note but not take into consideration or certainly excuse the bigotry based on culture or location.	3	1	0	0	0	0	0	0
3266	"Doing it to ""maximize productivity"". I'm curious how high they think productivity can go. It seems they think that there is an endless supply of productivity and people don't get tired and don't need breaks."	0	2	0	0	0	0	2	0
3622	Exactly. Did they bother teaching OP about Korean culture while she was growing up? Did they bother teaching her the language. She could have been included from a very young age, but it sounds like they didn't do a damn thing. So because OP's dad is dead, she's what - his replacement? Ew. AND if they truly want a relationship with OP, they need to apologize to her mother and to her for their past mistreatment AND need to stop shitting all over her Chinese ancestry.	1	2	0	0	1	0	0	0
9200	Make no mistake, Le Pen was a friend to jews and the gay community. Her loss will lead to an increase in murders and hate-crime against those communities, inevitably. 	2	3	0	0	0	0	0	1
17018	"lol I've always thought this when I read those studies about how those employed are ""happier"" than those who are unemployed. No shit, it's hard to be happy if you have can't keep a roof over your head, or food on your table. I do think there are certain types who are lonely and rely heavily on the workplace to supply socializing, and therefore would see a decrease in happiness in retirement. Thank god that isn't me, though."	0	1	2	0	0	0	0	0
12393	That's called sexual assault. It's a stunning lack of respect and a really scary future to your relationship.	1	3	0	0	0	0	1	0
7478	In this gif, Le Pen is making fun of Macron by mocking him. In one of his speeches, he had spoken badly about Front National ~~supporters~~ members/activists, whom he sees as cowards and haters (I'm painting in broad strokes here). She interrupted him by referrencing this speech, which might have caused her most fanatic supporters (hi /r/the_dumbass, hi /r/Le_Pen, hi discord!) to moisten their pants, but to the average viewer, I think she just looked like a crazy person. Edit: pretty good write-up by the NYT: https://www.nytimes.com/2017/05/03/world/europe/marine-le-pen-emmanuel-macron-france-presidential-debate.html	0	1	0	0	2	0	0	1
5645	I guess all I would like to remind you of is that this is an illness - this is not a moral issue or an issue of will power - you have a chemical imbalance and perhaps a spiritual longing - again, there is nothing moral about this. Im sending hope and love that you will be gentle with yourself.	0	3	0	0	0	0	0	0
16361	You sounds like a lovely, humble person and I. Sure your friends and family love you /s	0	1	1	0	1	1	1	0
313	&gt; All lives matter Is a false equivalency argument meant to deflect from the **centuries** of harm done willfully against lives *specifically* because they were black. Not all lives are treated the same. Black Lives Matter.	3	1	0	0	0	0	0	0
7356	If youre that guilty you should let him know u are sorry and it haunts you. He may forgive you or he may not. At least you can let him know you feel bad about it! That is also good you feel bad about it :)	0	1	0	0	2	0	1	0
9830	NTA. Im sorry you have a possible monster in law. I would talk with your fianc and if he chooses not to stand up for you and just bows in front of his mom. Maybe this isnt the relationship for you. If he feels the same way she does about you changing your mind about kids, this could be a big issue later on in your marriage. Also, if he is going to let his mom treat you this way and not make sure you are taken care of emotionally, GIRL RUN. Thats gaslighting and its hella toxic.	0	3	0	0	0	1	0	0
138	"""Make no mistake: on climate, there is no Plan B, because there is no Planet B"" - Emmanuel Macron "	0	1	2	0	0	0	0	0
16780	eh its true - these are unprecedented times. I didnt mean to be aggressive or harsh but rather truthful and upfront. apologies, never intend to offend anybody	0	2	1	0	0	0	0	0
16783	encouraging violence is okay, as long as its leftist violence	0	1	1	0	1	0	0	0
35	 Hope he tears down the house, these criminals must pay!	0	1	1	0	0	0	2	0
4873	How am I calling everyone a fascist? Calling Le pen a fascist isn't calling everyone a fascist. Unless you think Le pen is everybody. LOL, that's dumb. 	1	1	1	0	0	0	1	0
16626	"[Macron actually talked about it in his post-elected public speech](https://youtu.be/yqzclCq4qg0?t=3m6s) Roughly translated ""*I want to have a word for those who voted for Le Pen - today they expressed anger, disarry, sometimes convictions. And I respect them. I will do everything in the next 5 years so that they have no more reason to vote for the extreme*"""	0	1	2	0	0	0	0	0
16992	just because your gf bruises easily doesn't make it better?? that just means her blood cells literally damage more easily therefore you should be MORE careful good god	0	3	0	0	0	0	1	1
12490	That's what I keep telling him and my parents. I wish they'd take me seriously.	0	1	1	1	0	0	0	0
793	"&gt; unless something changes, our consent to be governed is being revoked. US government and liberals everywhere: ""iS tHaT a ThReAt?"""	0	1	1	2	0	0	1	0
7316	If you respect women dont call them slutty. Thats not respect, youre just an asshole lmao. If you actually respected women you wouldnt say things like then she shouldnt dress that way because women can dress however the fuck they want.	3	1	0	0	0	0	0	1
17421	Off leash means your dog _doesnt have to be on a leash_. That doesnt mean theyre allowed to bother other people or that you dont have to watch or control them. Off-leash isnt code for dogs can do whatever. And nobody can complain.	0	1	1	0	0	0	1	0
1432	Absolutely NTA. Shes asking you to commit insurance fraud which is a felony.	0	1	1	0	1	1	0	1
13211	There is some sense in feeling guilty. Feeling guilty helps to realise where you've gone desperately wrong. Letting that guilt fester and eat away at you is something you shouldn't do. It could ruin you for the rest of your life.	0	1	0	0	2	0	0	0
14085	Trans women are women regardless of operations. There's no debate to be had about this.	3	1	0	0	0	0	0	0
3385	Dude shes 11 your telling you would comfortable with your vulnerable child who doesnt know any better talking with random men everyday especially a person you dont know or have even seen this is how people get kidnapped he may be a good guy but he doesnt know that.	0	1	0	0	2	0	0	0
4571	"He's trying to ""understand"" by shaming other workers just trying to get by. God damn do I hate the structure of our society"	1	2	0	0	1	0	0	1
14503	We groom people to face Danger and expect nothing and justify it by calling them heroes	0	2	1	0	0	0	0	0
2169	At least I shame Nestl every opportunity I get. They're slave-profiteering scum.	1	2	0	0	1	0	1	0
9411	Men are praised for their grey hair, and women are shamed. Forget him. Be yourself. Spread that body positivity!	3	1	0	0	0	0	1	0
15487	YTA. Just take it and put it in a cupboard or something, geez. Your mother put time and energy into something because she was proud of your work. Sure, she changed the colours but damnit lots of people would love to have a mother that cared enough to make a whole blanket for them. Spare her feelings, say thank you, stick it in a cupboard or drawer somewhere and maybe get it out if she visits. It's a lovely gesture even if you don't really love the end result.	0	2	0	0	1	0	0	0
13841	This poor child, constantly being screamed at and treated like shit. No wonder she is doing poorly. She may not even have a disability , it may just be the emotional abuse hindering her.	0	3	0	0	0	0	0	0
11886	"Someone that constantly has to profess their honesty is usually not that honest. He's trying to guilt you by reminding you of the ""sacrifice"" that he's making by being a ""honest guy"". He's setting you up so that when he eventually cheats, he can say ""Well, what about all the other women I rejected?"" I'd be careful, OP."	0	1	0	0	1	1	0	1
6610	I wonder how he feels about what he has done? How he wasted that man's life so pointlessly.	0	2	1	0	0	0	0	0
16444	"You're publicly expressing an opinion to demonstrate the moral correctness of your position on ""social justice warriors."" So per your definition, you're virtue signaling."	1	1	2	0	0	0	0	0
7538	Ipcc says reduce carbon by 45% from 2010 levels by 2030, and carbon neutral by 2050 &gt;The report finds that limiting global warming to 1.5C would require rapid and far-reaching transitions in land, energy, industry, buildings, transport, and cities. Global net human-caused emissions of carbon dioxide (CO2) would need to fall by about 45 percent from 2010 levels by 2030, reaching net zero around 2050. This means that any remaining emissions would need to be balanced by removing CO2 from the air. https://www.ipcc.ch/2018/10/08/summary-for-policymakers-of-ipcc-special-report-on-global-warming-of-1-5c-approved-by-governments/	0	1	2	0	0	0	0	0
4135	God calls us to love one another. God also made your friend - perfectly and wonderfully made. He made him a gay man. I think if we want to love our neighbours as we love ourselves, then we support their right to enter a loving, committed relationship. Sorry, but YTA.	3	2	0	0	0	0	0	0
13745	This is the most vicious thing I've seen an idea do since Communism in the 20th century..	0	2	0	0	1	0	0	0
9760	NTA, don't apologise for setting boundaries or she won't learn her lesson. Noone has the right to touch others without permission, you didn't overreact.	1	3	0	0	0	0	0	0
10240	Nope. You were wrong. Trump never endorsed her, it's mainstream crooked media bias. The entire media, entire political elites want Macron because he's a stooge that will bring more of the same. People like you don't care about anyone but yourself.	1	2	0	1	1	0	1	0
12968	The problem is left leaning voters wouldn't see Fillion as a lesser evil. He is just social conservative as her, even more if we are talking about gays and fundamentalist christianity, and ultra economic conservative, he's a Thatcherite who wants radical austerity, where Le Pen wants to increase the welfare state. 	0	1	1	0	0	0	1	1
7742	It isn't that simple, children only get removed from parents if there is a very serious reasons involving high risks of harm. Saying your parents are shunting you and pushing you aside for a new baby isn't itself cause to remove either you or your sister (when she arrives) from their care. Don't be afraid to speak out at school etc. Most social services have a range of services to offer to help families; they don't WANT to remove children unless it is absolutely necessary. I hope that relieves you a little!	0	3	0	2	0	0	0	0
5066	I always begged my parents for these at the mall for some reason. They hurt my cheeks, they smelled like death, and it wasn't like the bubble it made was any fun.	0	1	1	0	1	0	0	0
16507	Your mum sounds like addicted to shopping and she is spending more than she has, you could suggest to he/ your father therapy but you need to stop enabling her addiction	0	2	0	1	1	0	0	0
8371	Jewish religious schools feel under attack by secularism, Fillon supports putting religion ahead of the state, which they like.	0	1	1	0	0	0	1	1
11592	Shes not ruthless. Shes a selfish coward. Shes throwing her friend and ally under the bus and allowing lies to spread about him because itll benefit her.	1	1	0	0	1	1	1	0
15116	Who cares about being judged? Fuck other peoples' opinions. Your happiness comes first and foremost.	0	2	1	0	0	0	0	0
9316	Maybe to you. But if you overhear it or have to comfort/support a coworker who experienced it, you fucking document it.	0	1	2	0	0	0	1	0
14916	What the hell are you talking about!!!?? It clearly insinuates that those who didn't vote for Le Pen did so because they weren't racist! Are you blind? I don't hope that France collapses at all, I just note that the current status-quo is already unacceptable and I do not believe that people will tolerate this forever.	0	2	1	0	0	1	0	0
15329	Would be nice if the economically illiterate realized that everyone having their needs taken care of by default is far better for the economy than the intellectually dishonest drivel they spew in the name of concepts they don't understand (free market, capitalism, etc).	0	2	1	0	0	0	0	0
2637	But their child is the same person they knew. A persons personality doesnt depend on their body, name, pronouns etc. They didnt lose their child.	0	2	0	0	0	1	0	0
123	"""It"" jesus christ. YTA and honestly a horrible, sociopathic person. I hope your parents DO kick you out; you don't deserve their generosity."	0	2	0	0	0	1	2	1
11657	So Le Pen would eliminate terrorism? What you smoking bro 	0	1	2	1	0	0	0	0
7482	In uplifting news, Mathias Depardon, a french journalist, who was incarcerated in Turkey for a month on flimsy charges, is now free and in a plane back to France! (Macron had to tell Erdogan to get his shit together.) Hundreds of (turkish) journalists are still incarcerated in what used to be a democracy. 	1	1	2	0	0	0	0	0
14931	What would be more embarassing is actually *being* a little bitch by going the rest of her life without acknowledging it and apologizing.	0	1	1	0	1	0	0	0
5457	I don't think you understand how actual kinky sex works. Respect and trust is still required, just like with any other intimate experience. If a sex act makes you _actually_ lose respect for your partner, either don't do it at all, or work on your issues until you can separate the sexual fantasy from reality.	1	2	0	0	0	1	0	1
14687	Well yeah but its pretty much hurting everyone the same. Sorry Bernie, I really do hope you get the nomination.	0	2	1	1	0	0	1	0
1418	AND now he's initiating sex without discussing the argument? OP is a sex toy to this guy.	1	1	1	0	0	0	0	1
6685	I would say the opposite and you have it backwards. The Dems have taught people to hate fellow citizens and told them that the only solution is more government. We should absolutely distrust the government.	0	1	0	3	0	2	1	0
15750	Yeah, thats bullshit honestly. I think that stuff applies if say, somebody alienated their friends because of their drinking and then makes amends etc; not for stuff like sexual assault and manslaughter imo. I think you did the right thing and a lot of people would have done the same in your position. Youre NTA.	1	2	0	0	1	1	0	1
6950	I'm suggesting a system where companies are not more important than lives of real people. Because they aren't. I think we've lost our way as a society. Companies, money, profit.... don't really exist, it's just things we made up to simplify our lives. But somewhere along the way those thing became more important that the lives of people.	1	2	1	1	0	0	1	0
15522	Ya, but Le Pen also hates Jews as well as Muslims. 	1	1	0	0	1	0	0	0
2946	Cops dont really help stop people killing themselves. They need an ambulance.	0	1	2	1	0	0	0	0
3449	Early signs of fascism- Powerful and continuing nationalism Disdain for human rights Identification of enemies as a unifying cause Supremacy of the military Rampant sexism Controlled mass media Obsession with national security Religion and government intertwined Corporate power protected Labor [sic] power suppressed Disdain for intellectuals &amp; the arts Obsession with crime &amp; punishment Rampant cronyism &amp; corruption Fraudulent elections	2	1	0	0	1	0	1	0
13699	This is not some uncontrollable thing. You have a choice. Youre the kind of person who could rape someone and not take accountability. Get some fucking help	2	1	0	1	1	0	0	2
10746	Ooh we remember, we always remember. I remember all my bullies from age 4 - 13, after that i got tough and dealt alot of smackdown on alot of would be bullies. Even gave one a slight concussion, yeah a basically learned how to fight. To bad not many children learn how to fight back and take control of the situation. So an apology would do wonders though. I would love if my old bullies would apologize to me.	1	2	1	0	0	0	0	0
15266	Why? The hospitals don't need pregnant women taking up beds and using essential supplies during this crisis. They should be promoting abortion.	0	2	0	0	0	0	1	0
4452	He means he has his so he doesn't care about all the uninsured people in America and people who go broke from medical care costs.	0	3	0	0	0	0	0	0
14011	To be fair its not really a grand colation or national unity, since the only parties participating as such are En Marche and Modem. Others joined the government individually, and the platform is strictly Macron's (with a slight addition from Modem), not a coalition platform.	1	1	2	0	0	0	1	0
6523	I was actually joking. Federal law prohibits discrimination and only a few legit exceptions exist. The joke being: every employer thinks they are above the law - until someone actually calls the law.	1	1	1	2	0	0	1	0
11348	Rule 3 says accept your judgment. It doesnt ban you from answering questions/responding to comments Btw, YTA. This was an incredibly selfish thing to do	0	1	0	0	2	0	0	1
13525	They've always been pro cop when when those cops are taking away American's rights.	1	1	0	2	0	1	1	0
9749	NTA you dont own them interaction. If you dont feel like talking to them, You have all the right to ignore them. Dad was TA for not getting the hint.	1	1	0	0	1	0	0	0
16040	You are truly fucking worthless. Wow. The saddest part is youre too fucking stupid to ever have that realization for yourself. So give your witty comeback, construct your own sense of purpose while the rest of us find a way to replace the air you waste every single day.	1	1	0	0	2	0	0	0
3377	Dude I think Bernie is racist. No shit I'm gonna think Le Pen supporters are racist.	2	1	0	1	0	1	0	1
916	&gt;ISIS threatens to bomb the election and a potential bomb is discovered at a Macron rally? It still means Putin's going to kill Macron. Wtf does the one have to do with the other??	0	1	2	0	0	0	0	1
5942	I looked it up and the age of consent there is 15, so I would recommend reporting this to the police. If you know where he lives, even better. Im sorry this has happened, good on you for looking out for your sister.	0	3	0	0	0	0	0	0
8858	Lol I know nothing can be done abt these posts cuz theres no evidence theyre fake (other than critical thinking) but my eyes roll back in my head anytime I see a post abt some beautiful thin angel owning an obese caricature of a person who totally deserves it. Im also genuinely concerned abt the effect these posts have on ppls body image.	0	2	1	0	0	0	1	0
9235	Man, you really fucking hate Muslims. It's always good to know who you are talking to. And this user here is a huge islamaphobe. His comment history is downright nasty towards an entire culture. So take everything this person says with a grain of salt. This person wants Le Pen because she suits his viewpoints that Muslims are evil. This isn't exactly the voice of reason right here. 	1	2	0	0	2	0	1	0
4673	Hes goofing off while the anthem is playing. Obama didnt salute a marine outside Marine One because he had shit in his hands and got bashed. Trump dances around like an undisciplined 4 year old and nothing is wrong? No disrespect?	1	1	0	1	0	1	1	0
2997	Current macron and social democrat ideology is not up the ecological and social challenges we are facing : they bow to uber and applaud to the destruction of workers protections, have nothing in stock to prepare against the unemployment increase linked to automatization, they are not willing to put forward the legislation to face the ecological emergency and all want to get a positive commercial balance which is arithmetically impossible. Same old shit will repeat the same old failures.	0	1	2	0	0	0	0	0
12458	That's overweight. The highest ideal BMI for her age is 21.8 because child BMIs are different from adults. She is in the 93rd percentile for BMI for her age, for context the obese category begins at the 95th percentile. A few more pounds, and she's obese.	0	1	1	0	1	0	0	0
10662	Omg I dont know why but this made me sob. What a beautiful heart you have! Definite YWNBTA. It sounds like they both would enjoy sharing their obvious love for her cooking. Her love language for him sounds like food, and that is a special connection you could all share. Agreed with other comments that maybe you could casually suggest you could help with groceries every once in a while, like a you cooked, so Im happy to contribute something! Kind of deal. The world needs more awesome and open hearted foster parents. Good job being an awesome human.	0	1	0	0	2	0	0	0
2777	Cancel culture is one of the left's most sadistic ways of ruining lives/careers.	0	2	0	0	1	0	0	0
15698	Yeah, at what fucking gas station do the customers come first? Never been in one where they treated customers with any sort of nicety or urgency. Sometimes they straight up ignore you standing at the register because they're doing other shit and there's nobody else scheduled. That or they didn't show up. You want both done? Hire more people. I would have quit as well. Fuck your boss.	1	1	2	0	0	0	1	1
