ID	text	Equality	Care	Non-Moral	Authority	Thin Morality	Loyalty	Proportionality	Purity
10627	Ok but this is the type of shit and shatters lives. If you dont expose them, youll end up never holding them accountable for their bullshit. And itll take a toll on you in the end. And you dont deserve that.	0	2	0	0	0	0	2	0
112	"""I've decided I'm not ready for intimacy or sex, so let's just keep it platonic."" That's it. You don't have to explain or justify yourself. This is what consent is about - you only do what you want to do."	1	1	2	0	0	0	0	0
2201	Awesome! This is what should happen when people cant be civil and dont treat each other with basic human decency (aka respect) ...they lose their privileges! Ive never been more embarrassed to be an American.	3	1	0	0	0	0	1	0
5107	I am looking for something. But I just feel bad because hes really angry about it. Hes threatening to just use one at school (yes school is in person here).	0	1	0	0	2	0	0	0
5292	I didn't even realize that he didn't mention whether his cousin was injured, but it certainly does seem like he doesn't care if she was.	0	1	2	0	0	1	0	0
14462	We are absolutely pessimistic about the future elections. From now, we will have to choose between : - Franois Fillon : a hard right-wing who wants to destroy our health care system. - Marine le pen : a neo-nazi woman who wants to leave europe.	1	1	0	0	1	0	0	0
6586	I will say that my experience has been the complete opposite. Internalizing my profession and deriving purpose from it was the root cause of my depression and something we were able to unpack and address early on. Sorry to hear you have not had the same positive experience as me.	0	2	1	0	0	0	0	0
6506	I vote for an attorney too. Her lack of respect for your boundaries so early on in the marriage is a bad sign. Reading OPs post makes me so angry for him. Its extremely disrespectful what she did. Your wife is definitely an TA for not respecting your feelings , your boundaries and for not teaching her daughter to respect others as well.	1	3	0	1	0	0	1	1
10598	Oh yeah. I almost forgot we aren't a fascist dictatorship.	1	1	1	0	1	0	0	0
12736	The daughter sounds like she might be depressed, getting bullied, self harming or something else. This is not normal	1	2	1	0	0	0	0	0
9008	Macron does seem to have the sense to not murder people for approval ratings	0	1	1	0	1	0	0	0
7495	Indeed, Mr Hollande. And you have played your part in maintaining or widening the cracks that threaten those things. 	0	1	2	1	0	0	0	0
14963	What. The. Fuck. Is wrong with you. This is the most disgusting thing I have ever heard, and the fact you enjoy it could be a sign of some mental illness. Popping your pimple on an elevator window is very, very far from normal. Please seek help	0	1	0	0	1	0	0	2
7196	If that culture is bigotry, it is garbage. If the bigoted elements of the culture can be removed that is great but upholding bigotry because it is tradition or culture makes you a bigot an an AH.	1	1	0	0	1	0	0	1
10807	Ouch - that is mean. Even I wouldn't tease Hollande about that...	0	2	1	0	0	0	0	0
10671	Omg the fuck is wrong with these schools. What kinda of obnoxious adminstration makes shit like this.	0	1	0	2	1	0	0	1
2480	Bosses now have access to your home. This is hell, let's hope that it will end soon and we will return to the cages.	0	1	2	0	0	0	0	0
10094	No, I think anybody involved in a foster family should have therapy regarding the situation.	0	2	1	1	0	0	0	0
669	&gt; We tried therapy but it looks like the therapy is for me to cope with the loss of my pet., Maybe its just how OP words it, but that sounds pretty darn manipulative to me.	0	1	2	0	0	0	0	0
4223	Gotta appreciate that Univision shill, as if CNN really cares about the Hispanic community.	0	1	1	0	1	0	0	0
11509	She did the break cuz she wanted to bang someone else without the guilt of cheating. Now that didnt work out and she is back to you . Eject	0	1	1	0	0	2	0	0
12194	Thank you for having a coherent moral structure. I don't even care if I agree with you or not; I'm just happy that some people are contemplating the effects of their actions with logic.	0	1	0	0	2	0	0	0
13663	This is good. It's good for people to be reminded of how utterly despicable the tobacco companies are, of how they specifically targeted small children to buy their brands and get them accustomed to the oral fixation of a cigarette hanging off their lip.	0	1	0	0	2	0	0	0
10491	Odd that you seem to support symbols of racism while being a continuous poster on /r/raceplay.	3	1	0	0	0	0	0	0
585	&gt; Salty? What do I care about France? HAHAHAHA, you are commenting on this thread, so you cleary do care. And it's butthurt because your nazi candidate lost. &gt; I'm British. I enjoy mainlanders making fools of themselves. Don't worry. Macron is a hard-brexiter.	0	1	2	1	0	1	0	1
1522	Agree with this. Heartless. How is an 18 year old, 30 days postpartum with a newborn, no home and no help supposed to get a job? This couple was supposed to be the adults in this situation. They should have had a legal agreement with contingency for just this situation. The baby is the one who ends up hurt here.	1	3	0	0	0	0	1	0
9494	Most recently, that reminds of Le Pen's denial of the crimes and violations by Vichy France as not perpetrated by the French. She wants young French people to be proud of their nation, not by celebrating their achievements, but by ignoring their faults.	0	1	0	1	1	1	0	1
10046	No one uses gay as an insult anymore?? Come on its 2020 were respecting the lgbt+	2	2	0	0	0	0	0	1
8162	Its more complicated than this obviously, but lets assume best-case that only 50% of our total population gets infected (it will likely be higher than this). The current fatality rate is 3.4% based on the most recent testing data Ive seen. Even if we assume its closer to a 1% fatality rate, heres where we end up: 327,000,000 x 0.50 x 0.01 = 1,635,000 deaths. So... stay inside.	0	1	1	0	1	0	0	0
5166	I bet you would be even happier if your labor wasn't being exploited by the owning class.	1	2	0	1	0	0	0	0
13948	This. He clearly has some sort of severe anxiety or ppd. He needs to get help. I don't see him as an ah, he's more just scared, and the need to get away is understandable. But the timing is horrible. Op needs to have a conversation with him where she acknowledges his fears and ask him to see someone about them if he really can't get past them. The trip is just a bandaid, but the issues will still be there when he gets back. Nta gently	0	3	0	0	0	0	0	0
16218	You know that the big corporations steal water from indigenous communities and beyond? Fuck that. Let her take the water if she needs it.	0	1	0	1	0	0	1	0
13120	Their right to commit brutality is a matter of principle to them.	0	1	2	0	0	0	0	0
5240	I cant believe anyone is actually as willingly ignorant and hateful as you, so Im choosing to believe youre just a troll. In which case, I feel pity for you, and I believe that you still have the opportunity to become a decent member of society. Good luck.	0	1	1	0	1	0	0	0
14455	We all have to die, but not before our bodies do... Let's break the cycle y'all. Presence, generosity of spirit, kindness, refusal (to the greatest extent possible) not to let our lives be stolen from us in this way... There is beauty to be found here, even in the midst of this broken system.	0	2	0	0	1	0	0	0
5020	I agree that approaching things with a healthy degree of skepticism and a desire to understand the inherent biases we all have is a good way to engage with information being presented to you. But refusing to believe something just because it doesn't fit with your belief system is a much easier way to be fooled by fake news. I'm not making any statement about the content of the article or the subject. Just reminding people to stay engaged in discussions as that's the only way we grow as a community.	0	1	0	0	1	2	1	0
3005	Daily reminder. According to Hollande, 'the rise of extremism' and 'the greatest threat to democracy ' is no longer foreigners actively targeting, killing, and raping Europeans. It is a wave of democratically elected leaders with opposing viewpoints. Let that sink in.	0	2	1	2	0	0	0	0
674	&gt; What I'm interested in is how this is supposed to help fight Le Pen. It's not, it's just the European Parliament letting the French police do their fucking jobs enforcing the law. This is not going to stop her presidential campaign, she will get a small fine at most. Of course presidential candidates will be under more scrutiny in most civilized countries. People have to stop making everything into a conspiracy theory.	0	1	1	1	0	0	1	1
6068	I mean, this is true in some cases for sure.. However, there is something to be said for toxic individuals seeking out vulnerable people.	0	3	0	0	0	0	0	0
14787	What a ridiculous statement, this place is so sheltered when it comes to awareness of what candidates who aren't blindly pro EU status quo stand for. He's not anti EU, he's not pro-Russian, these are buzzwords used by the political establishment to scare his voters away, and they are wrong. If you care about the current EU status quo, Macron is your guy, if you care about the French people, Mlenchon probably should be your guy.	0	1	2	1	0	0	0	0
3488	Emily is still a misogynist. Internalized misogyny makes life hell. Look how special I am, not like other women who all suck.	3	1	0	0	0	0	0	1
15464	YTA is your wife a human or just a sex object to you? A double mastectomy is no joke. She could have died and all you can say is gee I wish you had bigger boobs? I hope she leaves you.	1	2	0	0	1	1	0	2
10483	Obviously not I cant recall the last terror attack on a European nation. Its not actually an issue with effects reverberating across the continent. There has been no country in Europe which has seen a skyrocketing rate of violent crime, sexual assault and hate crimes against jewish people. Macron is right to say France has no culture and it must accept millions of migrants as a moral right.	2	1	0	0	1	0	1	0
16145	You don't understand Marine Le Pen very well. She's not racist, she's not right wing, and she certainly isn't a racial supremacist. You're imagining opponents, and then maligning real people by painting them as such. 	2	1	1	0	0	0	1	0
10721	One question, why do you persist with this when it's clearly upsetting for your girlfriend? If you respect her at all, including her feelings, you would desist with this. You're basically putting low grade eye enjoyment above her happiness and not respecting her insecurities? Stop that shit and then apologise to her for trivialising her issues.	0	3	0	0	0	0	0	0
4123	Go tell your mom now. Don't wait just get it out of the way beforehand. Its more respectable and she may have an answer or advice for you.	0	1	1	2	0	0	0	0
3437	ESH. Its ironically humorous that hes so obliviously saying you should apologize without seeing that he should as well, but if you wronged her and know it, why not give the apology?	0	2	0	0	1	0	0	1
82	"""Don't touch people without their consent"" is not actually a difficult concept."	1	1	1	0	0	0	0	1
16994	landlords complaining about being called bourgeois why dont you cry into the money you leech from people who need it	0	2	0	0	0	0	2	0
5750	I have to disagree. I personally believe that using someone else's body for sexual gratification against their knowledge is a consent violation, even if they are aware something *may* happen. If it isn't explicitly agreed to, it's wrong.	0	1	0	0	1	0	0	1
9474	Most Fillon voters are old people. Old people are the never-FN type which is why most of them are voting for Macron. Le Pen has been trying to get them more sympathetic by being less EU- and euroskeptic and more homophobic, but that hasn't worked so far. I think the ones going for Le Pen are the more engaged and ideologically right-wing voters.	1	1	2	0	0	1	0	0
17274	we should be able to choose our work hours without shame or fear of judgment	1	2	0	0	1	0	0	0
6466	I trust that two of them deal in human trafficking and the other two are just uneducated morons	1	1	1	0	1	0	0	0
9099	Macron isnt part of his party though. Valls might hope for a job in Macros cabinet. Even if he agrees with Macron more, its still something very treacherous to do and also disrespectful to his own party and the members who voted for Hamon. Even if he doesnt agree with Hamon, he doesnt have to actively fight against him.	0	1	1	0	1	1	0	0
1435	Absolutely depends on your state- so if you own a firearm you gotta research your local laws. For me, I'm lucky enough to be in a pro-CCW, castle doctrine (with vehicle extension), stand your ground, and pro-defensive display state. If you decide that my possessions are worth more than YOUR life or my / my families life, everything is on the table and I'm not giving up an inch.	1	1	1	0	0	0	0	0
16233	You know, I wish they would so they stop fucking up the planet and let us fix it.	0	1	1	0	1	0	0	0
4169	Good More people stand up to bullshit more likely there would be less bullshit My naive self likes to think	0	1	0	0	1	1	0	1
609	&gt; That's why Le Pen's support is surging despite her awful nationalist rhetoric? I think her support is surging precisely because of her nationalist rhetoric. If her supporters simply wanted the expansion of the welfare state they would vote for someone like Mlenchon or maybe Hamon. Let's not sugar coat, they vote Le Pen because they are racist. 	2	1	0	1	0	1	1	0
1999	Are they seriously trying to attack Macrons wife for nude photos? The amount of hypocrisy is hilarious.	1	1	2	0	0	0	0	1
13695	This is not about who is entitled to vote, it is about including them in the census count that is used to decide seats in Congress by district.	1	1	1	0	0	0	1	0
11963	Sounds like you want petty revenge. You don't know if he took advantage of her and you really don't care, you just want her to suffer like you did. That's not okay behavior. YTA	1	3	0	0	0	0	0	1
14842	What does the joke mean to you? Do you seriously believe that it's that Le Pen's gender is the reason she won't win the election? If so, how is that funny?	2	1	1	0	0	0	1	0
4236	Great comment. As someone who's known serious illness, I get internally frustrated with the people who openly admit to being hypochondriacs, who look every symptom up on WebMD and think every sniffle is Covid. But I manage to keep my damned mouth shut. Their anxiety hurts them too.	0	2	1	0	0	0	0	0
12219	"Thank you, I was hoping someone would speak the truth here. People fought and died for our right to a 40-hour work week, let's not forget their hard work just to make some ""woke"" statement. The work week should and can be lower, people need to just fight again for that."	0	1	1	0	0	1	2	0
1898	And? That doesnt change the fact that clothes of any type are for humans of any gender.	3	1	0	0	0	0	0	0
16367	You tell her fine, you're obviously not going to try and force her into having sex. She just needs to realize that this strike isn't going to result in the outcome she wants, and she either needs to talk things through with you in counseling, or you're going to take her unilateral demands and withholding of affection to mean she's no longer interested in treating this marriage as a loving partnership and proceed accordingly.	0	1	1	1	0	0	0	0
15297	With some people, sure. Don't worry about them. A lot of people won't care.	0	2	1	0	0	0	0	0
9658	My timekeeping was never great, but it was mostly me not being there ten minutes before my shift, instead maybe six or seven minutes, that I wasn't being paid for. My manager was pretty good, but he was getting bitching from above about it, despite me putting in free time after work, filling in sick days for others, and generally being a model worker. Why can management not weigh up the very minor downsides against the huge upsides and decide maybe it's time to shut the fuck up?	1	1	1	0	0	0	2	0
2122	As much as OPs feelings are in the gutter cause of what happened, they did a terrible thing and there isnt much to lighten their feelings.	0	1	1	0	1	0	0	0
8125	Its a good start if youre trying to move up the economic ladder. College grads income &gt; non college grad	0	1	2	0	0	0	1	0
8634	Le Pen isn't really a conservative and France still has PTSD about hitler and WWII.	0	1	2	0	0	0	1	0
5358	I don't get this... Then how do your peers know to respect you for being big, strong, and manly? /s	1	1	1	0	0	0	1	0
5396	I don't like le pen. But she wasn't a fascist. Lets be real. Trump is also not a fascist. They're conservatives who are nationalists 	0	1	2	0	0	0	1	0
4968	How? Cheating hurts because it's someone you trust lying to you and telling you to doubt what they know is the truth. That's brutal and sounds damned emotionally abusive imho.	0	3	0	0	0	2	0	0
15555	Yeah I feel like alot of people have done stuff like this. Me and a couple buddies would steal money and items from the store we worked at. They ended up telling a girl at another location that we were doing it, she told our manager and our manager asked us about it and said she didn't believe the girl. So we waited a few months and went right back at it. I was making good money at that minimum wage job lmao.	0	1	1	0	0	2	0	0
1358	"A certain segment of the French population supports ISIS. By posting these images Le Pen was trying to show them and others the horrors of their atrocities and raise awareness about the threat they're facing. You think all the people slaughtered in the Paris and Nice attacks is just ""fear-mongering""? You recommend burying you're fucking head in the sand when a group wants to wage genocide against your nation and kill your children?"	0	3	0	0	0	1	0	0
14464	"We are being [dehumanized](https://plato.stanford.edu/entries/feminism-objectification/). Emotional neglect and [Emotional Blackmail](https://www.amazon.com/Emotional-Blackmail-People-Obligation-Manipulate/dp/0060928972) are rampant and normalized. And these [behaviorist-styles](https://youtu.be/KlJ_Qp8DmGI) if discipline used to ""squash the behavior"" cause the same brain injury as physical beatings bc we are inherently a social species."	0	3	0	0	0	0	0	0
8014	It's not your fault, and your mum is a horrible parent. She was supposed to protect you, when you were a child. Counseling, yes, but talk to your dad, tell him you are still traumatized , and could you stay with him, 'til you get your life in order. Your mum needs to be in jail. So sorry, hope you can find a parent, that cares for you !	0	3	0	1	0	1	0	1
2837	Children have a strong attachment to their toys and stuffed animals. It must be devastating for that little girl every time something of hers get thrown away. This parenting is not teaching her any valuable lessons. Here are the things this child is learning: love is conditional, anything I value can be suddenly taken away, I am never safe. I can't begin to imagine the insecurity and anxiety that child must be feeling on a daily basis. Your cousin's parenting methods are barbaric, cruel and counter-productive.	1	3	0	1	0	0	1	1
445	&gt; If Macron's attacks relied on her being attached to FN and were on FN... They'll still be valid. She ran with the FN, was the FN candidate in the first round, will return to the FN after this. He can attack her for being in the FN *and* slam her for being spineless and trying to fool people. Her only defense would be to distance herself verbally from the FN, and any reason she would give would mean denigrating some of her voters.	0	1	0	1	2	0	0	0
13291	These commenters are legitimately scary like why so casual and almost proud of sexually assaulting someone? Id never trust someone again if they did that to me	1	2	0	0	1	0	0	1
16509	Your not wrong for feeling free of your abuser. Enjoy your newfound peace of mind ( eventually it will sink in ).	1	2	0	0	0	0	0	0
12419	That's horrible and sounds like they just want revenge. I feel really badly for their daughter if revenge is the only reason he wants any sort of custody.	0	2	0	2	0	2	0	0
15774	Yeah. Also, it's so sad we barely have time for our friends and family. It's hard to get together because people often just want to rest after being done work or the work schedules don't line up. We work and then we die.	0	3	0	0	0	1	0	0
4499	He was pulling away because his hand was being crushed by the mighty high-torque grip of Macron. Get cucked. 	0	1	2	0	0	0	0	0
7145	If he'd not taken stupid advice to treat unreasonable people reasonably (I've been there) he'd have plausible deniability.	1	2	1	0	0	0	1	0
9867	NTA. Youve mentioned nothing about him being gay being a part of your disdain. Sounds like you would have reacted exactly the same if it was a female he was cheating with	3	1	0	0	0	1	0	1
15306	Woah dude. You called your kid a burden. Damn. Your username is 100% correct. You should be thrown away.	0	1	0	0	2	0	0	0
10660	Old people voted overwhelmingly (78-22, best result from all age groups) for Macron, so calling them racist is not fair. Never thought I'd like the voting behaviour of old people, though.	2	1	0	0	1	0	1	1
12339	That sounds so socialist, caring for others around you. No wonder Republicans hate that.	0	1	0	0	2	0	0	0
17447	bandits aka, people trying to survive under capitalism who have been give very limited options for survival but FUCK THEM, AMIRIGHT?! tHeY sHoUldNt StEAL	2	2	0	0	0	0	2	0
12377	That's also not helpful. Sometimes we need to check what is really helpful in these situations, whilst 21 weeks may be not in the early stages, a babies chance of survival (outside the body) at this stage is low and miscarriages can still occur at this gestational age. Also, babies that have severe issues in utero can spontsneously abort. It is also common to miscarry if the mother is particulatly young.	0	1	2	0	0	0	0	0
12929	The only thing that people like this respond to is boldness/ assertiveness. This is your fault. You were sexist and shitty. Your apology is lazy and worthless. If you want things to be different, you have to make up for the past. Make Amends. To your brothers: Our parents were sexist and shitty. They were hurtful and immature. This is Their Fault. Stop defending their shitty sexism. Unless you want to be shitty and sexist as well? Because thats what youre telling me- that you want to be shitty and sexist too.	2	1	0	0	0	0	0	0
2425	Beware the race-baiting, gender-baiting, fake-ass posts in this sub. It's to the point where I think the majority are now this crap. Are we due for another abortion post yet?	1	1	2	0	0	0	0	0
17451	 Thank you Mr. Macron 	1	1	1	1	0	1	0	0
7096	If Macron doesn't do well, it won't matter. People will get desperate and vote for Le Pen and the like when their concerns are not met. And if it's not Le Pen, it could be someone even more intelligent and well spoken. The European far right has gained a fairly significant following the migrant crisis and increased frequency of terror attacks in the wake of Brexit and the growing popularity for Wilders and Hofer. These 5-10 next years will determine their future. 	0	0	2	1	0	0	0	0
9270	Marine Le Pen, your nationalist, divisive and populist politics did not impress the judges on the runway. Sashay away. Emmanuel Macron, you stand for unity, tolerance and reasoned argumentation - you're a winner baby. Shante you stay.	1	0	1	1	0	0	0	0
16256	You mean he ordered his workers to do that, he probably did none of the actual work in programming that.	0	0	1	1	0	0	2	0
1521	Agree with everything you say, which is why I'm wondering whether its just Le Pen supporters sowing seeds to either gain more traction or influence other peoples choices into abstaining. I have a hard to believing someone who would vote Melenchon would support Le Pen, well I guess maybe if they were supporting him tactically knowing that he'd call a frexit referendum without the social stigma involved of supporting Le Pen.	0	0	1	1	0	2	0	0
13465	They support Trump and the GOP not because they're stupid and unaware. But because they are aware and they are morally bad people. It's not a lack of knowledge, it's a lack of moral decency. Us pretentious libs keep telling ourselves we just need to educate them more but that is way off the mark.	0	0	0	1	2	0	0	0
6648	"I would agree for any other candidate than Le Pen. For a party full of nazis, founded by nazis, with very nazi ideas, i truly think she does not represent democracy. It's not the same thing at all, and it's a valid dichotomy, in this particular case. Also, OP never said ""if you are not for Macron, you are not democratic"". S/he said that Le Pen is Pro-Russia, Anti-EU and seeks to destroy that line of politics in France. That's pretty public, it's basically her plan."	0	1	0	1	1	0	1	1
6285	I tend to agree with this. The political climate is ripe for a centrist with smart ideas based in evidence over people who shout the loudest. Tacking hard to the left is a terrible idea for the Dems and tacking right has been disastrous for our country, even though it's been a net gain for the GOP. Our political culture has become so toxic that we need a Macron-like figure to enter the game at some point. 	0	1	0	1	2	0	0	0
6335	I think it is pretty much common knowledge that Republicans try to suppress voters. Their leadership will come right out and say more people voting is bad for Republicans.	0	0	1	1	1	0	0	0
6951	I'm sure Macron doesn't expect them to do anything, but calling them out on their shit instead of kissing their ass is what makes him more sensible than many other leaders.	0	0	0	2	1	0	0	0
5093	I am a firm believer that cities should have a set area and should not be allowed to expand. Instead giving way to allowing nature to thrive. But no, our governments and capitalist overlords would rather our country be covered in concrete and tarmac. I'm sick of it	0	1	1	2	0	0	0	0
