ID	text	Equality	Care	Non-Moral	Authority	Thin Morality	Loyalty	Proportionality	Purity
16946	imagine being so far gone that you compare an unborn child to a plant. you make me sick	0	1	0	0	0	0	1	3
8297	Im sorry to hear about that, but if youre still thinking of it now thats your penance	0	1	0	0	1	0	0	1
4852	Hope you get caught you racist pos. People like you always get what's coming to them one way or another. Talking about rights and privileges like you aren't scum more than the people you chastise for being here.	3	1	0	0	0	0	0	1
3309	Don't read comments in that sub, it's just devistating to see capitalism won, they've brainwashed people saying work is something you contribute to make society better.	0	0	2	0	0	0	0	1
5275	I despise censorship, clearly, you do not, given that you have your talking stick, I mean flair	0	0	1	0	1	0	1	1
2531	Btw no leftist in France considers Macron as a leftist. Socialist Party- yeah, they are massive frauds	0	0	1	1	0	1	0	1
6481	I understand, we all have to make sacrifices. Praise Macron! 	0	0	0	0	1	2	0	1
16839	hope your life goes to shit even though your sister is fine. you fucking degenerate	0	0	0	0	2	0	0	1
10537	Oh goodness, that is almost never the case. The making amends/apology phase is an integral part of the pattern of abusive behaviour, and it often foreshadows an escalation in violence. The tendency of abuse victims to believe, or want to believe, that their abuser is sincerely remorseful keeps them locked into increasingly dangerous situations. *Not saying your hope is wrong, but it seemed important to have a comment attached to yours that reminds other redditors who may be current victims of abuse that what they are seeing is a part of the cycle, not the cycle being broken.*	0	2	0	0	1	1	0	1
1092	&gt;anti-FN are even more eager to vote against Le Pen after this leak. That is going to be their narrative come Monday, mark my words. They'll claim false flag, voter fraud, and cucks. Nevermind that they were generating the frenzy.	0	1	2	0	0	1	0	1
16961	it is in cultures where large groups are in the same boat. it becomes an implicit understanding that you dont challenge these truths about people. people are capable of remarkable feats of rationalizating the irrational, given enough group pressure. so nobody sees what is wrong with a society built on keeping up appearances.. untill they find out how toxic it is and how many people deeply suffer due to these hypocrisies.	1	2	0	0	1	0	0	1
6388	I think the Republicans fucked up pretty bad when they didn't elect Nathalie Kosciusko Morizet. She's certainly flawed, but I think she would have been an appealing compromise between Fillon and Jupp. And I haven't heard any corruption scandal coming from her (it doesn't necessarily mean anything).	0	0	1	1	0	0	1	1
11540	"She nearly killed him and then denied him contact with his family because they're salty she nearly killed him. Her ""prank"" could qualify as domestic violence."	1	3	0	0	0	1	1	1
5763	"I havent seen anyone else yet mention this, do please know: Guilting, pressuring and giving consequences (""I wont have sex with you if you dont do this"") is called sexual coercion and considered sexual assault. Additionally he's guilting and manipulating you, and when you take time away from that behavior, he's turning around and claiming you're doing that to him. This man is an abuser. Please leave him."	1	2	0	0	1	0	1	1
3226	"Does France have a shy right wing factor? Here in the U.K we have ""shy Tories"" who don't choose the Conservatives in polls because they're ashamed of being branded evil Tories but actually vote for them come elections because they agree with their policy. Any such effect in France or are people pretty upfront and honest about supporting Le Pen?"	0	0	2	0	0	0	0	1
1912	Anti-natalism isn't about wanting to die or wanting others to die, it's about believing life is immoral to create. Saying 'People cannot consent to exist and so we should not make them' is not at all condoning or encouraging suicide. Anti-natalism seeks to minimize suffering, which suicide does not do on a communal scale.	0	3	0	0	0	0	0	1
13062	The unrelenting positivity thing makes me sick Its a great method of brainwashing yourself into being okay with the many absurdities we face on a daily basis, its also a result of investing deeply in the false ideals of meritocracy Id rather listen to some doomer talk about how hes going to lay down and die than some equally disillusioned douchebag who thinks he can smile his way out of the pitfalls of capitalism	0	0	0	0	1	0	1	1
3656	Except for the countless people who happily denounced their neighbours as being jews. There's a reason calling someone a 'collabo' in France is one of the nastiest insults there is. That said, it is hilarious to see Marine Le Pen, the leader of a party partially founded by collaborationists to want to absolve them.	0	1	1	0	1	0	0	1
3728	"Fascism: an authoritarian and nationalistic right-wing system of government and social organization ""Marine Le Pen vows to suspend immigration to 'protect France'"" ""'No other religion is causing problems' Le Pen continues to back burkini ban"""	2	2	0	0	0	0	0	1
4454	He might have been an asshole, and he might have deserved being put in his place, but you shouldn't have said that. I've lost a parent and I know how that'd feel. I think you should be the better person and apologise. I'm assuming both of your parents are still alive because I don't think you'd have said it otherwise. When you lose a parent, I think you'll feel guilty. Do the right thing, man. Then there's no difference between you and him. I get it's been 6 years, but I bet he still thinks about it. I would.	0	3	0	0	0	0	0	1
602	&gt; Thankfully, our police forces are not yet mired by such Nazi ideologies welllllllllll	0	0	0	2	1	0	0	1
752	&gt; make me a cake with the Ten Commandments on it Better still, with: &gt;&gt; Leviticus 18:22 - Thou shalt not lie with mankind, as with womankind: it is an abomination.	0	0	0	1	1	0	0	1
13071	The way they talk about people is disgusting. It's always divisive negativity. People want positivity. Shameful.	0	1	0	0	1	0	0	2
14553	We think its fake because you are putting up with a huge amount of disrespect and mistreatment, bordering on abuse.	2	3	0	0	0	0	0	1
805	&gt; you cant just retroactively remove consent during this sex act, You can remove consent at any time for any reason. It is indeed that black and white.	0	0	1	0	1	0	0	1
16113	You didn't know. She didn't know. You apologized. Good. She wasn't affected. Live the rest of your life decently and I think you'll be a great human.	0	2	0	0	1	0	0	1
4001	Fuck objectivity, here's all you need to know about the race: Le Pen: Batshit crazy borderline neo-nazi Melenchon: Batshit crazy commie Fillon: Super corrupt conservative. Hamon: socialist, not as crazy as Melenchon Macron: left-leaning, liberal, only good guy in the fight	1	1	0	0	2	0	0	1
17356	you mean like macron's wife that molested him as a 15 year old when she was a 40 year old married teacher?	0	1	1	0	0	0	0	1
9847	NTA. They have no say in what you do with your own house. Not only did they not inform you of their intentions, but you didn't even know your deceased neighbors. You're not under any obligation to performatively mourn people you didn't know, just because other people are doing it. This year sucks, let people have holiday lights.	1	2	0	0	1	0	1	1
4833	"Honestly, even if I did get a boner, I wouldnt be able to just ""jerk one out"" to make it go away. I'd feel so disgusting that I'm jerking off right after my partner opened up about being raped. I literally would not be able to feel comfortable doing something like that especially while my partner is very obviously hurting."	0	2	0	0	0	0	0	3
13729	This is stupid... makes me want to do something, but everything I think of isnt very Christian.	0	1	1	0	1	0	0	1
1257	"/uncuck People who support Donald and le pen don't care about well reasoned arguments or words. They just take pleasure in using them however. Look at their ""outrage"" over Colbert's joke. This is from people who routinely make attack helicopter is a gender jokes. They use whatever argument pleases them because ultimately they are hiding the true reasons they are populists: racism, emotions, etc. If we are able to respond in kind with unserious remarks, then you have a credible way of shutting them down. /cuck This but unironically"	1	3	0	0	0	0	0	1
15812	Yep. California does have the effect of pushing people who dont get brainwashed easily to the right	0	0	1	0	1	0	0	1
15486	YTA. &gt; I know its not right to lie, but I dont see a reason why I cant walk in their neighborhood. It's their neighbourhood. It's private property. You don't need to 'see' their reasons. &gt; I never dress inappropriately, play music out loud, go into peoples yards, or litter. Again, immaterial. Though I'll point out that you do lie and trespass, which doesn't speak well to your moral character. Nor does this little bit of blatant manipulation: &gt; Im also pregnant	1	1	0	0	2	0	0	1
7627	"Isn't Le Pen in a ""scandal"" aswell? Seems like noone cares about that though."	0	0	2	0	0	0	1	1
3164	Do nothing? You are racist. Send me texts trying to express love and concern? You are making my life worse.	2	1	0	0	1	0	1	1
2567	But dont use books that use the beta male termilogy. Because theyre complete horseshit	0	0	2	0	0	0	0	1
5781	I honestly kinda wish you'll suffer everyday of your life for being such a piece of sh*t human being. Edit: No forgiveness for rapists.	0	1	0	0	2	0	0	1
11857	Some money helps alleviate many of the causes of unhappiness, primarily stress.	0	0	2	0	0	0	0	1
724	&gt; does that mean I'm a trump / le pen supporter for thinking they should be deported / arrested No, I believe you're a Trump/Le Pen supporter if you support Trump/Le Pen. ...is English so fucking difficult?	0	0	1	0	0	1	1	1
5175	I can almost guarantee you that you wouldn't. It's very easy to say you'd be a perfect angel when commenting on someone else's story, and much harder to not be a person with emotions and needs if it was actually happening to you.	0	1	1	0	1	0	0	1
1554	Ah so we can't hold Macron or Hillary accountable for what we do know about them bc who knows about Le Pen and Trump. Thats reasonable. To expand on that I also think that I shouldn't be able to be arrested for a crime I commit until the police search everyone else in the world bc while I might be guilty we need to know everyone else's guilt relative to my own. 	1	0	0	0	1	0	0	1
10840	Paint yourself orange and tell him you hate Mondays and see if he gets aroused	0	0	2	0	0	0	0	1
10458	OP is almost certainly cashing her SSI and disability checks and I am certain, also collecting welfare and food stamps on her behalf. I have seen that kind of abuse before. Keep the invalid alive...but only just alive...so some lout can collect their benefits.	0	1	0	0	0	0	2	1
5666	I had a teacher sit me down in 4th grade and explain to me that I had to stop all of my sexual remarks towards other students during recess. I was genuinely innocent of what I did wrong, so this 60 year old man had to take a deep breath and give 9 year old me hand gestures towards his penis while telling me to suck it, and then ask me not to do that to anyone again. Thanks DX.	0	0	1	1	1	0	0	1
10281	Not do that anymore. Dont try to pressure anyone into sexual activity theyre not comfortable with. No means no.	2	3	0	0	0	0	0	1
11739	So she's implying that LGBTQ people all cheat and that is normal? Sounds like she is the homophobe. Using her bisexuality to justify cheating and throwing all the LGBTQ people under the bus.	3	1	0	0	0	0	1	1
11542	She needed to be a lot harder both on Bernie and Trump. Watching the Macron debates I think if she was even half as vocal and passionate she'd have won. But then again she'd have had to deal with the sexism that would be hurled at her if she showed any human side. Sigh. 	3	0	0	1	0	0	0	1
13703	This is one of my greatest fears in life that a male friend or acquaintance is secretly being a creep and violating my privacy	1	3	0	0	0	0	0	1
11902	Sometimes it fills the void in people's lives, but this void is sometimes also filled with masturbation, drugs and pyromania, so it doesn't make work automatically good or necessary.	0	0	0	0	1	0	0	2
3986	"From what I hear from a *lot* of people here, Macron represents finance, banks, soul-crushing capitalism, etc. Left-leaning and ""anti-system"" people viscerally hate him."	0	1	0	0	2	1	1	1
11775	So what happens when the millions that have Muslim friends or are dependent on Muslims in some way (such as them being bosses of other people) just get a bunch of headaches because someone thought that the root of all problems was that one Muslims who owned a local shelf business ? Honestly if you think that le pen would remove all muslims from france then thats already being nazi level of brainwashed and ignorant and scary.	2	2	0	0	0	0	0	1
3139	Didn't this guy essentially fuck over his brother really hard and then take a shit ton of the earnings? Overall, this guy is a shithead posing as a Saint and people buy it.	0	1	0	0	1	2	0	1
4171	Good Christ, youre 19 and shes 31. Thats predatory - go ahead and argue against it, but based on all your responses, youre clearly too young to understand. No amount of life experience you think you have before youre 20 justifies dating someone 12 years your elder. Im 28 and youre a child to me, I wouldnt even entertain the idea! When you mature some and look back youll realize how disgusting the whole situation is.	2	1	0	0	0	0	0	3
15441	YTA - it is nasty that you are making this sexual. It is sunscreen...on someones back.. you have some issues.	0	0	0	0	0	0	0	3
12079	Sure, but you didn't address my claim that breeding in wage slavery is cruel and thoughtless.	1	3	0	0	0	0	0	1
12783	The fascist brigade is doing everything they can here to keep sensibility buried. Le Pen is fucking disgusting. When someone persists with a party, tainted as it is by *extremely overt* nazi sympathies, its clear that this person does not reject such an ideology. She merely wants it out of the spotlight while people are still able to make their decisions about her. 	1	0	0	1	0	0	0	2
15179	Why criminalize things like murder too, theyre just the natueal state of humanity.	0	1	0	0	1	0	0	1
12011	"Still, it shouldn't matter who he married or even if he cheated. I forgot the ""s/"" but it's good to see that people despise what I just wrote, even if I was joking. &gt;Macron actually did it That will always be amusing, not gonna lie..."	0	1	0	0	1	1	0	1
7027	INFO: why does the paternity test need to be prior to the birth?	0	0	2	0	0	0	0	1
15237	Why should traitors have any choice? They gave up any rights as a citizen. Fuckem.	0	1	0	0	0	3	0	1
11038	"Post Malone is constantly espousing anti-government pro-gun rhetoric. They can never cancel him as long as kids like listening to ""poppin' pillies and fuckin' hoes""."	0	0	2	0	0	0	0	1
2529	Bruh, I just looked up an image of Julia and that hairstyle isnt sexual at all. Nit to mention you put all this effort in to do something sweet for him. NTA , seriously, your bf sounds like jealous ass.	0	1	0	0	1	0	0	1
8069	"It's the parents who perpetuate this shit, not the kids. The kids are innocent and don't understand how to use words yet. It's the parents who say shit like, ""He must like you!"" and shit. It's disgusting and is normalizing that hitting is another form of affection"	0	1	0	1	0	0	1	3
15921	"Yes, he is literally using this ""client"" for his fetishes and hiding it from his girlfriend and friends, knowing its wrong. Its weird how all of the comments are praising him being an entrepreneur."	0	1	0	0	0	0	0	2
8021	It's odd for a Trump supporter to be criticizing anyone for sexual misconduct	0	0	1	0	1	0	1	1
11213	"Really? ""Sexual predator"" and ""bit of a prude"" are equally likely in your mind in this situation?"	0	0	2	0	0	0	0	1
14905	What the Bible says about giving: Generosity begets itself What fake Christians interpret it as: Free money machine	0	1	1	0	1	0	1	1
10693	Once bitten, shame on you. Twice bitten, shame on me. There shouldn't be a third time.	0	0	1	0	1	0	0	1
8805	Like it or not pegans and wicca are a religion. You wouldnt persecute a *christian* You wouldnt persecute a *atheist* You wouldnt persecute a *satanist* Persecution Is *wrong*	0	0	0	1	1	0	0	2
12281	That fact that people get pissed about proves how brain washed society is.	0	1	1	0	0	0	0	1
3607	Exactly this. It's incredibly invalidating, inconsiderate, and frustrating. Sometimes people do things that are unforgivable. They do not deserve to be forgiven, especially when they don't ask for it, or even express remorse over their actions. Pushing people to forgive assholes that don't even ask to be forgiven just gives them license to continue being an asshole. Acknowledging that they just suck isn't forgiveness, it's just radical acceptance. Please. Stop confusing the two as if y'all know what you're talking about. You don't.	0	1	0	0	0	0	2	1
6311	I think Trump is an incompetent idiot while Pence is just evil. 	0	0	0	1	2	0	0	1
9239	Many Final Fantasy characters were forced to marry disgusting evil monster figures in this very castle	0	0	1	0	1	0	0	1
1996	Are people who support Macron not everyday people? Maybe those people are sick of the misinformation coming from legitimately fake news sites. 	0	0	2	0	0	0	0	1
13285	These are SO MUCH BETTER than the new cards!!! I guess they redesigned the cards with no words on them, so the same cards can be used across the globe.....but they suuuuck.	0	0	2	0	0	0	0	1
1894	And, for the love of God, when someone tells you they hate looking at your son and they resent them so much, fucking believe it!	0	0	0	0	2	0	0	1
17394	Bye free speech - Twitter is not a government body. Otherwise, Ill get the feds to force my mums church group website to espouse my ashiest beliefs. Basically, sayin the same.	1	0	1	0	0	0	0	1
17403	Gaslighting is a form of psychological manipulation in which a person or a group covertly sows seeds of doubt in a targeted individual, making them question their own memory, perception, or judgement, often evoking in them cognitive dissonance and other changes such as low self-esteem.	0	0	2	0	0	0	0	1
12559	Thats the most foul, cruel, bad-tempered rodent you ever set eyes on!	0	1	1	0	1	0	0	1
473	&gt; It's only gaslighting when they don't believe what they're saying. That's just straight-up LYING. Gaslighting is making some effort to convince YOU that YOUR view of reality is wrong (and/or to abandon YOUR view and adopt THEIRS instead, because that would be so much more convenient for THEM). And they can shove THAT shit up their CANDY ASSES. I ALSO don't know why I had to CAPitalize so MUCH to emphasize those POINTS.	0	1	1	0	0	0	0	1
3666	Except the Sioux consider the mountain sacred and are very upset about the fact is already been descrated. Adding another racist POS to the mountain won't fix that problem, regardless of which side you put him on.	0	0	0	1	0	0	0	3
12332	That shirt i swear capitalists have some fucked up humiliation fetish	0	0	2	0	0	0	0	1
15847	Yes it is a human. Its not an adult, or born. But its definitely human. You think its a goat during the fetus stage or something? Its 100% a human fetus.	0	0	1	0	1	0	0	1
15456	YTA but not because youre miffed at the food. YTA because you are being judgmental about everything down to the Tupperware. Why does it matter that he has well-loved Tupperware? You just sound so stuck up.	0	2	0	0	1	0	0	1
8792	Licensed therapist here too - I commented the same exact thing. This crap is so terrible and he could actually harm someone heavily.	0	3	0	0	0	0	0	1
16969	it's definitely the closest France has ever come to an extremist government, but I agree it's unlikely that Le Pen will win. The only option where she wins, is the one where the second round is Le Pen vs. Melenchon (In popular terms: Nazi's versus Communists). If that is the case, Le Pen might actually profit from the disgust of many a Frenchman for both candidates. If the centrist voter stays at home, Le Pen is at a distinct advantage because her base is broader.	0	0	1	0	1	0	0	1
3912	France is losing its mind. Le Pen is as corrupt as they get, and funded by a foreign government while claiming to be a nationalist, and making unrealistic campaign promises.	0	0	0	0	2	0	0	1
6767	I'm *personally* antinatalist for myself because I have bad genes for colorectal cancer and depression and heart disease. I also have pretty severe ADHD. So between my fear of being a bad father, and the fear of passing on lots of bad genes to inflict on my child, I feel it's better to let healthier people have kids. I guess it's sort of a eugenecist approach. But the thing is I'm not judging or making decisions for anyone else. Just me.	0	2	0	0	1	0	0	1
11831	So...you're saying that *everyone* on the planet over the age of 30 is human garbage? Because that was the only way to get our photos? OK, bud.	0	0	1	0	1	0	0	1
1153	&gt;white people are disgusting. Entitled. Hateful. Lie spreading planet killing parasites that can all go somewhere.. Else Does vitriol not go both ways? Because it sure seems you exhibit every point regarding hatred and entitlement that you accuse white people of.	1	1	0	0	1	0	0	1
9595	My husband brought horse chaff (cut up hay) as marijuana as a teenager	0	0	2	0	0	0	0	1
9542	My continued faith in humanity requires this man to not be real. Therefore, I shall pretend that I never saw your update.	0	0	0	0	0	0	1	2
9851	NTA. You didn't get them evicted, their own actions did.	0	1	2	0	0	0	0	1
1926	Any fetish can be abusive if someone is made to participate in it without their knowledge or consent, as was the case here.	1	2	1	0	0	0	0	1
11867	Some people don't want to teach their kids to be sexist or racist. Some people do. These people shouldn't really have kids together, since the parenting plans don't match up.	1	1	1	1	0	0	0	1
12670	The amount of bootlicking and protection of the status quo in the original thread is nauseating	0	0	0	2	0	0	0	1
6826	I'm gonna be honest. I wish European countries would implement a full on secular law that prohibits all religious symbols in public. Like the one Le Pen was talking about I heard once. None of religions have actually ever been proven to be true and majority of people don't even get a choice of choosing them. 	0	0	1	1	0	0	1	1
3238	Does it really? How many Jews did Le Pen's party kill? The hyperbole from the left never ceases to amaze me.	1	2	1	0	0	0	0	1
823	"&gt;5% of people in Paris voted for Le Pen. Paris, where all the ""islamificafion"" and the terrorist attacks are happening. **I never understand how it's always the rural areas that vote out of fear of something that does not even impact them, while those directly impacted stick with their principles.** Easy answer, education. People on rural areas are usually less educated, less informed and so on than on people who live on large cities, so it's easy to influence them. It's the same in almost all countries. "	0	1	2	0	0	0	1	1
14770	What I hope is that Macron will use the occasion to pass electoral reform and create a Dutch style proportional representation system in the legislatives. That alone would convince any sceptics that he's not just another power-hungry politician. But most importantly it would ensure healthy debate and make people feel that their views are being represented.	1	2	1	1	0	0	2	1
16298	You realize that if you actively discriminate/boycott against gay weddings simply because theyre gay, that makes you homophobic and no amount of saying you arent will change that.	2	1	0	0	0	0	1	1
9971	Nigel Farage: &gt; Foreigners are evil and destroy our country. Macron &gt; Foreigners should earn the same wage as their French counterparts. A race to the bottom is not an option.	1	1	0	0	1	0	1	1
7648	It 100% is. Assholes do this all the time to test boundaries and it always starts small like this.	1	1	0	0	2	0	0	1
3840	For all things sacred I hope Macron wins. This is the battle that America should had have, the authoritarian right of Trump against the more human anti-establishment left of Bernie Sanders. 	0	0	0	1	2	0	0	1
6409	I think they just have a email fetish. Hillary and emails, macron and emails. And cuckoldry too.	0	0	2	0	0	0	0	1
2101	As an American, thank goodness Fillon is likely out. Sick of religious zealots, and I'm from the US. 	0	0	1	1	0	0	0	1
140	"""Marine Le Pen suggested France's Jewish community should refrain from wearing religious clothing or symbols in an effort to combat Islamic extremism."" Blaming the victim for the abuse. Much like saying ""Well, if women don't wanna get raped, they shouldn't wear revealing clothing."" Fuck you."	2	3	0	0	0	0	0	1
15694	Yeah, and his supporters like are all sexually repressed sycophants. They love to imagine themselves living Trumps lifestyle. The thought of underage prostitutes would just make them more infatuated with the orange idiot.	0	0	1	0	1	0	0	1
16860	https://en.wikipedia.org/wiki/Gay_concentration_camps_in_Chechnya Wow. You're literally criticizing Macron for formally protesting concentration camps and the torture of gay people - something that Trump has been too cowardly to do. I always wondered why so many Americans wanted to appease the Nazis rather than take up arms against them. 	2	2	0	0	0	0	1	1
8214	Ive always kinda felt that nostalgia is a force of incorrectly unwarranted happiness--you want to feel happy about these reminders of the past but you feel like its lost, or that you arent aloud to feel it for the same reason. Ive found that nostaligia can be a great source of true and pure happiness if you can learn to let go and let those feeling wash over you. These reminders arent lost to the past, they exist within you forever, always available to feel in your present!	0	2	0	0	1	0	0	1
11804	"So you would rather be bullied by him and his mother forever? Thats your other option to ""just leave this asshole""."	0	2	1	0	0	0	0	1
